{
  "format": "brokoli.task-bundle/v2",
  "name": "fast-hash",
  "interface_digest": "sha256:6b86b273ff34fce19d6b804eff5a3f5747ada4eaa22f1d49c01e52ddb7875b4b",
  "source_digest": "sha256:d4735e3a265e16eee03f59718b9b5d03019c07d8b6c51f90da3a666eec13ab35",
  "payloads": [
    {
      "id": "native-linux-amd64",
      "runtime": "native",
      "os": "linux",
      "arch": "amd64",
      "entrypoint": {
        "executable": "bin/fast-hash-linux-amd64"
      },
      "effects": "pure",
      "payload_digest": "sha256:4b227777d4dd1fc61c6f884f48641d02b4d121d3fd328cb08b5531fcacdabf8a"
    },
    {
      "id": "native-darwin-arm64",
      "runtime": "native",
      "os": "darwin",
      "arch": "arm64",
      "entrypoint": {
        "executable": "bin/fast-hash-darwin-arm64"
      },
      "effects": "pure",
      "payload_digest": "sha256:ef2d127de37b942baad06145e54b0c619a1f22327b2ebbcfbec78f5564afe39d"
    }
  ],
  "files": [
    {
      "path": "bin/fast-hash-linux-amd64",
      "size": 8192000,
      "sha256": "e7f6c011776e8db7cd330b54174fd76f7d0216b612387a5ffcfb81e6f0919683"
    },
    {
      "path": "bin/fast-hash-darwin-arm64",
      "size": 8355840,
      "sha256": "7902699be42c8a8e46fbbb4501726517e86b22c56a189f7625a6da49081b2451"
    }
  ]
}
