{
  "format": "brokoli.task-bundle/v2",
  "name": "score-orders",
  "interface_digest": "sha256:6b86b273ff34fce19d6b804eff5a3f5747ada4eaa22f1d49c01e52ddb7875b4b",
  "source_digest": "sha256:d4735e3a265e16eee03f59718b9b5d03019c07d8b6c51f90da3a666eec13ab35",
  "build": {
    "builder": "brokoli-python-sdk/0.9.0",
    "attestation": "sha256:4e07408562bedb8b60ce05c1decfe3ad16b72230967de01f640b7e4729b49fce"
  },
  "payloads": [
    {
      "id": "python-any",
      "runtime": "python",
      "requires": ">=3.11,<3.14",
      "os": "any",
      "arch": "any",
      "entrypoint": {
        "module": "src.tasks",
        "symbol": "score_orders"
      },
      "effects": "pure",
      "dependency_lock": "deps/requirements.lock",
      "payload_digest": "sha256:4b227777d4dd1fc61c6f884f48641d02b4d121d3fd328cb08b5531fcacdabf8a"
    }
  ],
  "files": [
    {
      "path": "src/tasks.py",
      "size": 1942,
      "sha256": "ef2d127de37b942baad06145e54b0c619a1f22327b2ebbcfbec78f5564afe39d"
    }
  ]
}
