{
  "format": "brokoli.task-bundle/v2",
  "name": "heavy-transform",
  "interface_digest": "sha256:6b86b273ff34fce19d6b804eff5a3f5747ada4eaa22f1d49c01e52ddb7875b4b",
  "source_digest": "sha256:d4735e3a265e16eee03f59718b9b5d03019c07d8b6c51f90da3a666eec13ab35",
  "payloads": [
    {
      "id": "container-any",
      "runtime": "container",
      "os": "any",
      "arch": "any",
      "entrypoint": {
        "command": [
          "python3",
          "run.py"
        ],
        "args": [
          "--mode",
          "batch"
        ]
      },
      "effects": "non_idempotent",
      "payload_digest": "sha256:4b227777d4dd1fc61c6f884f48641d02b4d121d3fd328cb08b5531fcacdabf8a",
      "image": {
        "digest": "sha256:ef2d127de37b942baad06145e54b0c619a1f22327b2ebbcfbec78f5564afe39d",
        "reference": "registry.example.com/brokoli/heavy-transform:1.2.3"
      }
    }
  ],
  "files": []
}
